{
  "schemaVersion": "3.0.0",
  "pipelineId": "rule-logic",
  "metadata": {
    "jobId": "job-1791688323931-cnfyle",
    "title": "05 rule logic",
    "createdAt": "2026-10-11T03:12:03.931Z",
    "tags": [
      "auto-config"
    ],
    "overlayEffect": "confetti",
    "depth3d": {
      "enabled": true,
      "mode": "extruded_text_3d",
      "popOutIntensity": 1.3,
      "shadow": true
    }
  },
  "chunks": [
    {
      "id": "chunk-1",
      "order": 1,
      "text": "[Decision Node: Logic Proof Architecture]",
      "durationMs": 10000,
      "visualAsset": {
        "type": "image",
        "sourcePathOrBuffer": "assets/board_diagram.png",
        "resolution": {
          "width": 1920,
          "height": 1080
        }
      },
      "metadata": {
        "sourceVisual": "board_diagram.png"
      }
    }
  ],
  "audioComposition": {
    "ducking": {
      "enabled": true,
      "attenuationDb": -14,
      "attackMs": 200,
      "releaseMs": 350
    },
    "sfxMarkers": [
      {
        "timeMs": 200,
        "sfxPath": "assets/sfx_chalk.wav",
        "volume": 0.8,
        "category": "scene_sfx"
      },
      {
        "timeMs": 3000,
        "sfxPath": "assets/sfx_success_bell.wav",
        "volume": 0.9,
        "category": "scene_sfx"
      }
    ],
    "backgroundMusic": {
      "audioPath": "assets/bgm_classical.mp3",
      "volume": 0.25,
      "loop": true
    }
  },
  "distributionHints": {
    "supportedExporters": [
      "video"
    ],
    "targetAspectRatios": [
      "16:9"
    ]
  }
}