{
  "schemaVersion": "3.0.0",
  "pipelineId": "generative-storytelling",
  "metadata": {
    "jobId": "job-1791983752233-vtrmje",
    "title": "test mystery box",
    "createdAt": "2026-10-14T13:15:52.234Z",
    "tags": [
      "auto-config",
      "framework:mystery-box-explainer"
    ],
    "framework": "mystery-box-explainer",
    "scriptBeats": [
      {
        "name": "The Cold Hook",
        "timingSec": [
          0,
          5
        ],
        "audioRole": "hook",
        "visualPacing": "rapid_cut",
        "sfxCue": "sfx_heavy_bass_drop",
        "cameraPreset": "rapid_parallax_zoom",
        "typographyStyle": "bold_climax",
        "description": "Show the climax or disaster immediately without explaining why yet.",
        "narrationTemplate": "In an instant, everything changed because of one tiny detail everyone ignores about test mystery box."
      },
      {
        "name": "The Friction / Stakes",
        "timingSec": [
          5,
          15
        ],
        "audioRole": "friction",
        "visualPacing": "rapid_cut",
        "sfxCue": "sfx_tension_riser",
        "cameraPreset": "dynamic_pan",
        "typographyStyle": "high_contrast",
        "description": "Visually connect the abstract concept to daily reality under high stakes.",
        "narrationTemplate": "You interact with this every single day. And if it fails, it takes everything else down with it."
      },
      {
        "name": "The Title / Reset",
        "timingSec": [
          15,
          20
        ],
        "audioRole": "turn",
        "visualPacing": "intimate_hold",
        "sfxCue": "sfx_whoosh_click",
        "cameraPreset": "static_center",
        "typographyStyle": "clean_title",
        "description": "Visual reset. Clear the screen or wipe whiteboard clean for a 2-second breath.",
        "narrationTemplate": "To understand why, we have to look at how test mystery box actually works."
      },
      {
        "name": "The Metaphor Build",
        "timingSec": [
          20,
          90
        ],
        "audioRole": "metaphor",
        "visualPacing": "kinetic_motion",
        "sfxCue": "sfx_metaphor_flow",
        "cameraPreset": "continuous_pan_zoom",
        "typographyStyle": "explanatory_callout",
        "description": "The core visual engine. Progressive drawing, isometric reveal or tactile stacking.",
        "narrationTemplate": "Imagine test mystery box as an interconnected living system where every node must communicate with zero latency."
      },
      {
        "name": "The Turn / Complication",
        "timingSec": [
          90,
          120
        ],
        "audioRole": "friction",
        "visualPacing": "rapid_cut",
        "sfxCue": "sfx_minor_key_tense",
        "cameraPreset": "dramatic_shake_cut",
        "typographyStyle": "warning_strobe",
        "description": "Introduce visual chaos: system turns red, anomaly breaks the flow.",
        "narrationTemplate": "But there is a critical vulnerability. What happens when unexpected stress enters the architecture?"
      },
      {
        "name": "The Climax & Payoff",
        "timingSec": [
          120,
          150
        ],
        "audioRole": "climax",
        "visualPacing": "slow_burn",
        "sfxCue": "sfx_bass_impact_resolution",
        "cameraPreset": "hero_pullback",
        "typographyStyle": "thesis_reveal",
        "description": "Visual resolution: components snap cleanly into place revealing the thesis.",
        "narrationTemplate": "This is where the true breakthrough of test mystery box changes everything."
      }
    ]
  },
  "chunks": [
    {
      "id": "chunk-1",
      "order": 1,
      "text": "In an instant, everything changed because of one tiny detail everyone ignores about test mystery box.",
      "durationMs": 5000,
      "metadata": {
        "beat": "The Cold Hook",
        "audioRole": "hook",
        "visualPacing": "rapid_cut",
        "sfxCue": "sfx_heavy_bass_drop",
        "cameraPreset": "rapid_parallax_zoom",
        "typographyStyle": "bold_climax"
      }
    },
    {
      "id": "chunk-2",
      "order": 2,
      "text": "You interact with this every single day. And if it fails, it takes everything else down with it.",
      "durationMs": 10000,
      "metadata": {
        "beat": "The Friction / Stakes",
        "audioRole": "friction",
        "visualPacing": "rapid_cut",
        "sfxCue": "sfx_tension_riser",
        "cameraPreset": "dynamic_pan",
        "typographyStyle": "high_contrast"
      }
    },
    {
      "id": "chunk-3",
      "order": 3,
      "text": "To understand why, we have to look at how test mystery box actually works.",
      "durationMs": 5000,
      "metadata": {
        "beat": "The Title / Reset",
        "audioRole": "turn",
        "visualPacing": "intimate_hold",
        "sfxCue": "sfx_whoosh_click",
        "cameraPreset": "static_center",
        "typographyStyle": "clean_title"
      }
    },
    {
      "id": "chunk-4",
      "order": 4,
      "text": "Imagine test mystery box as an interconnected living system where every node must communicate with zero latency.",
      "durationMs": 70000,
      "metadata": {
        "beat": "The Metaphor Build",
        "audioRole": "metaphor",
        "visualPacing": "kinetic_motion",
        "sfxCue": "sfx_metaphor_flow",
        "cameraPreset": "continuous_pan_zoom",
        "typographyStyle": "explanatory_callout"
      }
    },
    {
      "id": "chunk-5",
      "order": 5,
      "text": "But there is a critical vulnerability. What happens when unexpected stress enters the architecture?",
      "durationMs": 30000,
      "metadata": {
        "beat": "The Turn / Complication",
        "audioRole": "friction",
        "visualPacing": "rapid_cut",
        "sfxCue": "sfx_minor_key_tense",
        "cameraPreset": "dramatic_shake_cut",
        "typographyStyle": "warning_strobe"
      }
    },
    {
      "id": "chunk-6",
      "order": 6,
      "text": "This is where the true breakthrough of test mystery box changes everything.",
      "durationMs": 30000,
      "metadata": {
        "beat": "The Climax & Payoff",
        "audioRole": "climax",
        "visualPacing": "slow_burn",
        "sfxCue": "sfx_bass_impact_resolution",
        "cameraPreset": "hero_pullback",
        "typographyStyle": "thesis_reveal"
      }
    }
  ],
  "audioComposition": {
    "ducking": {
      "enabled": true,
      "attenuationDb": -16,
      "attackMs": 150,
      "releaseMs": 300
    },
    "sfxMarkers": [
      {
        "timeMs": 0,
        "sfxId": "sfx_heavy_bass_drop",
        "volume": 0.8
      },
      {
        "timeMs": 5000,
        "sfxId": "sfx_tension_riser",
        "volume": 0.8
      },
      {
        "timeMs": 15000,
        "sfxId": "sfx_whoosh_click",
        "volume": 0.8
      },
      {
        "timeMs": 20000,
        "sfxId": "sfx_metaphor_flow",
        "volume": 0.8
      },
      {
        "timeMs": 90000,
        "sfxId": "sfx_minor_key_tense",
        "volume": 0.8
      },
      {
        "timeMs": 120000,
        "sfxId": "sfx_bass_impact_resolution",
        "volume": 0.8
      }
    ]
  },
  "distributionHints": {
    "supportedExporters": [
      "video",
      "social",
      "audio"
    ],
    "targetAspectRatios": [
      "9:16"
    ]
  }
}